Name,Product Id,Price,Material
Cashmere 5565 Red Traditional Rug by HMC,UR8711,£56.99,Polyester
Japanese Fans Ivory 039301 Wool Rug by Florence Broadhurst,FB0104,£388.00,Wool
Modern Poly Pixels Red Rug by Rug Style,UR4856,£19.00,Polypropylene
Modern Poly Squares Red Rug by Rug Style,UR4870,£19.00,Polypropylene
Nova 8881B Dark Blue Traditional Rug by Ultimate Rug,UR12905,£21.00,Heatset Polypropylene
Sari Myriad 8871 Luxury Rug by Louis De Poortere,DP2801,£374.00,Cotton
Portland 8425 B Modern Rug by Oriental Weavers,OW10787,£37.00,Polypropylene
Modern Poly Harvard Red Rug by Rug Style,UR4824,£19.00,Polypropylene
Spirit Blocks Teal Modern Rug by Ultimate Rug,UR9901,£27.00,Polypropylene
Enchanting ECH03 Grey Beige Abstract Rug by Calvin Klein,CK2509,£68.00,"Polyester , Polypropylene"
Prismatic PRS23 Black Multicolour Wool Rug by Nourison,NR3021,£649.00,"Viscose , Wool"
Rossa ROS03 Teal Abstract Rug by Concept Looms,CL1118,£88.00,"Polyester , Polypropylene"
Nova 9048A White Traditional Rug by Ultimate Rug,UR12915,£21.00,Heatset Polypropylene
Rustic Textures RUS12 Grey Multi Rug by Nourison,NR1435,£94.00,"Polyester , Polypropylene"
Rustic Textures RUS15 Light Grey Blue Rug by Nourison,NR1441,£94.00,"Polyester , Polypropylene"
3D Carved Diamond Navy Shaggy Rug by Ultimate Rug,UR11704,£35.00,Polyester
Celestial Midnight Blue Designer Rug by Christian Fischbacher,CF0302,£449.00,"Cotton , Polyester"
Interfloral 9051 Multi Designer Rug by Christian Fischbacher,CF0601,£649.00,Cotton
3D Carved Blocks Grey Shaggy Rug by Ultimate Rug,UR11602,£35.00,Polyester
Odyssey Earth Pink Abstract Rug by Rug Style,UR12109,£16.50,Polypropylene
Aurora Foam AU21 Rug by Asiatic,AS16127,£62.60,"Polyester , Polypropylene"
Indulgence Charcoal Shaggy Rug by Ultimate Rug,UR3738,£25.00,Polyester
Aspen 1794 Ivory Grey Shaggy Rug by Think Rugs,TR7501,£57.99,Polypropylene
Nourison Maxell MAE13 Ivory/Grey Rug ,NR0831,£107.00,Polyester
Nourison Navajo NAV07 Red Rug ,NR0911,£38.00,"Polyester , Polypropylene"
Nourison Passion PSN09 Multicolour Rug ,NR1110,£68.00,Polypropylene
Nourison Passion PSN03 Blue Rug ,NR1105,£68.00,Polypropylene
Saville Grey Raspberry Traditional Outdoor Rug by Origins,RG13403,£34.00,Polypropylene
Scandi Berber G276 White Black Shaggy Rug by Think Rugs,TR7004,£63.99,Polypropylene
Nourison Rustic Textures RUS05 Grey Rug,NR1409,£94.00,"Polyester , Polypropylene"
Nourison Ankara Global ANR07 Blue Green Rug ,NR1525,£39.50,"Polyester , Polypropylene"
Orbit Geometric Teal Rug by Ultimate Rug,UR13111,£42.00,Polyester
Blade Pink Plain Rug by Asiatic ,AS05731,£141.56,Viscose
Nourison Ankara Global ANR04 Blue Multicolour Rug ,NR1510,£39.50,"Polyester , Polypropylene"
Nourison Nomad NMD04 Aqua Rug,NR1607-1,£75.05,Polypropylene
3D Carved Diamond Ochre Shaggy Rug by Ultimate Rug,UR11702,£35.00,Polyester
3D Carved Blocks Natural Shaggy Rug by Ultimate Rug,UR11601,£35.00,Polyester
Lisboa 9054 Raw Topaz Designer Rug by Christian Fischbacher,CF0103,£449.00,Cotton
Indulgence Blush Shaggy Rug by Ultimate Rug,UR3736,£25.00,Polyester
Fiesta 8449 Suave Designer Rug by Christian Fischbacher,CF0502,£449.00,Polyester
Celestial 9059 Night Sky Designer Rug by Christian Fischbacher,CF0301,£449.00,"Cotton , Polyester"
Saville Blue Grey Traditional Rug by Origins,RG13401,£34.00,Polypropylene
Boston Latte Plain Shaggy Rug by Ultimate Rug,UR1725,£39.00,Polyester
Boston Lightning Red Striped Shaggy Rug by Ultimate Rug,UR1732,£30.00,Polyester
Scandi Berber G274 White Black Shaggy Rug by Think Rugs,TR7003,£63.99,Polypropylene
3D Carved Time Gate Red Shaggy Rug by Ultimate Rug,UR11004,£40.00,Polyester
Indigo Ochre Plain Shaggy Rug by HMC,UR7410,£41.00,Polyester
Designer Poly Patch Block Chocolate Rug by Rug Style,UR8912,£18.00,Polypropylene
Spirit Triangle Black Modern Rug by Ultimate Rug,UR9915,£15.00,Polypropylene
Traditional Poly Kayo Rose Rug by Rug Style,UR5145,£36.00,Polypropylene
Havanna Blue Grey Rug by Origins,RG12901,£59.00,"Polyester , Polypropylene"
Blazon Natural 3D Shaggy Rug by Ultimate Rug,UR10404,£41.00,Polyester
Traditional Poly Malak Red Rug by Rug Style,UR5174,£36.00,Polypropylene
Traditional Poly Esta Green Rug by Rug Style,UR5160,£36.00,Polypropylene
Shimmer Indigo Polyester Shaggy Rug by Origins,RG4811,£58.00,Polyester
Mumbai Red Modern Shaggy Rug by Ultimate Rug,UR10204,£49.00,Polyester
Stepping Stones Grey Shaggy Rug by Ultimate Rug,UR9405,£49.00,Polyester
Zola Lisar Persian Rug by Asiatic,AS19504,£164.71,"Polyester , Polypropylene"
Nourison Ankara Global ANR11 Blue/Multicolor Rug,NR1537,£39.50,"Polyester , Polypropylene"
Terrace Dragonfly Natural Outdoor Rug by Rug Style,UR9209,£39.00,Polypropylene
Urban Splash Multi Funky Rug by Ultimate Rug,UR13302,£45.00,Heatset Polypropylene
Zola Aras Persian Rug by Asiatic,AS19509,£164.71,"Polyester , Polypropylene"
Traditional Poly Coronation Grey Rug by Rug Style,UR5195,£36.00,Polypropylene
Spectra Coral Multicoloured Rug by Ultimate Rug,UR13403,£48.00,Heatset Polypropylene
Spectra Largo Multicoloured Rug by Ultimate Rug ,UR13413,£48.00,Heatset Polypropylene
Aspen 1799 Ivory Grey Shaggy Rug by Think Rugs,TR7506,£57.99,Polypropylene
Solace SLA07 Ivory Grey Blue Rug by Nourison,NR6417,£48.00,"Polyester , Polypropylene"
Solace SLA02 Ivory Grey Blue Rug by Nourison ,NR6403,£48.00,"Polyester , Polypropylene"
Arabella Hazy Blue Distressed Abstract Rug by HMC,UR13501,£58.00,"Polyester , Polypropylene"
Halsey Grey Geometric Outdoor Rug by Asiatic,AS18505,£71.86,Recycled Material
Varanda VA04 Natural Stripe Outdoor Rug by Asiatic,AS18904,£42.20,Polypropylene
Nico Grey Plain Rug by Asiatic,AS18701,£207.00,Polyester
Gatsby Blue Rug by Asiatic,AS14605,£256.04,Viscose
Grayson Cream Outdoor Rug by Asiatic,AS18403,£166.28,Recycled Material
Onyx ONX05 Silver Blue Abstract Rug by Concept Looms,CL0405,£228.00,"Natural Fibers , Wool , Others"
Royal Nomadic A175 Cream Grey Rug by Think Rugs,TR8942,£80.99,Polypropylene
Bazaro BAZ12 Natural Grey Striped Rug by Concept Looms,CL0112,£48.00,Polypropylene
Genuine Sheepskin Adobe Rose Rug by Origins,RG7810,£70.00,Leather
Antibes AN06 Blue Cream Geometric Outdoor Rug by Asiatic,AS18002,£42.20,Polypropylene
Arabella Opaque Cream Damask Textured Rug by HMC,UR13506,£58.00,"Polyester , Polypropylene"
Ives Navy Blue Modern Rug by Asiatic,AS07911,£49.82,"Natural Fibers , Cotton"
Onyx ONX11 Silver Grey Abstract Rug by Concept Looms,CL0411,£228.00,"Natural Fibers , Wool , Others"
Oslo OSL701 Pacific Striped Rug by Concept Looms,CL0606,£147.00,"Cotton , Wool"
Tropics TS04 Beige Floral Rug by Nourison ,NR6504,£304.00,Wool
Aston Green Plain Sparkle Rug by Asiatic,AS19605,£217.00,Viscose
Synchronic 442303 Brazilian Rosewood Origami Outdoor Rug by Harlequin,HQ3101,£228.00,Polypropylene
Jazz JAZ11 Rose Geometric Outdoor Rug by Concept Looms,CL0709,£129.00,Recycled Material
Onyx ONX03 Grey Geometric Rug by Concept Looms,CL0403,£228.00,"Natural Fibers , Wool , Others"
Gravel 68009 Wool Shaggy Rug by Brink & Campman,BC0104,£798.00,Wool
Checked Flatweave Black Rug By Oriental Weavers,OW5302,£31.00,Polypropylene
Orient 2529 Red Traditional Rug by Ultimate Rug,UR11419,£60.00,Polypropylene
Fading World 8263 Mineral Black Designer Luxury Rug By De Poortere,DP1504,£209.00,"Cotton , Wool"
Woodstock 032 0036 8312 Brown Chequered Rug by Mastercraft,MC2502,£49.00,Polypropylene
Tropics TS11 Taupe Green Floral Rug by Nourison ,NR6509,£304.00,Wool
Noble Art 6529 190 Beige Traditional Rug By Mastercraft,MC2302,£82.00,Polypropylene
Royal Classic 217W Antique Brown Rug By Oriental Weavers,OW7803,£132.00,Wool
Boston Red Plain Shaggy Rug by Ultimate Rug,UR1704,£39.00,Polyester
Vista 2236 Cream Solid Plain Shaggy Rug By Think Rugs ,TR7209,£22.99,Polypropylene
Playtime ABC Theme Mats By Oriental Weavers,OW8301,£37.99,Nylon
Fading World Scarlet 8260 Designer Luxury Rug By De Poortere,DP1517,£209.00,"Cotton , Wool"
Union Ivory Textured Wool Rug by Rug Guru,RG1601,£185.00,Wool
Whisper Mocha Super soft Shaggy Rug by Asiatic,AS01605,£47.26,Polyester
York Teal Simple and Stylish Wool Rug by Asiatic,AS02210,£42.20,Wool
Matrix Wire MAX35 White Wool Rug by Asiatic,AS04101,£162.20,Wool
Aran Ivory Plain Wool Luxury Rug by Asiatic,AS05404,£343.52,"Viscose , Wool"
Plush Red Luxury Shaggy Polyester Rug by Asiatic,AS06007,£128.86,Polyester
Plush Slate Luxury Shaggy Polyester Rug by Asiatic,AS06015,£128.86,Polyester
Blade Champagne Modern Classy Rug by Asiatic,AS05710,£141.56,Viscose
Windsor WIN08 Traditional Rugs by Asiatic,AS08608,£50.00,Polypropylene
York Poppy Simple and Stylish Wool Rug by Asiatic,AS02203,£42.20,Wool
Noble House NH-5858 Grey/Yellow Rug By Think Rugs,TR4619,£149.99,"Acrylic , Polyester"
Royal Nomadic 5746 Grey/Yellow Rug By Think Rugs,TR8908,£80.99,Polypropylene
Cascade Slate Luxury Polyester Rug by Asiatic,AS06108,£47.26,Polyester
Indulgence Choc Plain Shaggy Rug By Ultimate Rug,UR3710,£25.00,Polypropylene
Sloan Black/White Geometric Rug by Asiatic,AS07801,£59.72,"Cotton , Wool"
Plush Green Luxury Shaggy Polyester Rug by Asiatic,AS06001,£128.86,Polyester
Chicago Chocolate Polyester Plain Rug by Origins,RG4708,£53.00,Polyester
Noble Art 65124 190 Beige Traditional Rug by Mastercraft,MC2333,£82.00,Polypropylene
Arabesque Blue Modern Wool Rug by Oriental Weavers,OW0402,£98.00,"Viscose , Wool"
Montana Dark Grey Plain Shaggy Rug by Think Rugs,TR9912,£59.99,"Acrylic , Polyester"
Spirit Kite Ochre Geometric Rug by Ultimate Rug,UR9975,£27.00,Polypropylene
Karma Cloud Grey Plain Rug by Rug Guru,RG1701,£160.00,Viscose
Jazz JAZ13 Blue Geometric Outdoor Rug  by Concept Looms,CL0711,£129.00,Recycled Material
Sierra 9000 Slate Grey Plain Shaggy Rug by Think Rugs,TR6713,£41.99,Polypropylene
Cranes 57002 Pink Hand Tufted Wool Rug by Ted Baker,TB0501,£416.00,Wool
Spectro Stripes 442108 Marine Rust Outdoor Rug by Harlequin,HQ2901,£228.00,Polypropylene
Royal Jewel JEW01 Cream Green Traditional Rug By Oriental Weavers,OW1308,£70.00,Wool
Gabbeh 50 C Oriental Rug By Oriental Weavers,OW5601,£84.00,Polypropylene
Vista 2236 Grey Solid Plain Shaggy Rug By Think Rugs ,TR7211,£22.99,Polypropylene
Royal Classic 34P Traditional Rug By Oriental Weavers,OW7810,£132.00,Wool
Kelim Red Flatweave Rug By Oriental Weavers,OW0105,£38.00,"Cotton , Others"
Gabbeh 933 R Oriental Rug By Oriental Weavers,OW5611,£84.00,Polypropylene
Aston Sand Plain Sparkle Rug by Asiatic,AS19602,£217.00,Viscose
Sisal Linen/Sage Natural Decorative Rug by Asiatic,AS03607,£72.44,Natural Fibers
Brighton 098 0122 6000 96 Cream Striped Outdoor Rug by Mastercraft,MC3408,£21.99,Polypropylene
Bambino Rocket Mat By Oriental Weavers,OW8203,£20.00,Nylon
Checked Flatweave Natural Rug By Oriental Weavers,OW5306,£31.00,Polypropylene
Tropics TS13 Mocca Floral Rug by Nourison ,NR6511,£304.00,Wool
Jasmine 71 X Grey/Gold/Purple Abstract Rug by Oriental Weavers,OW12005,£114.00,"Polyester , Polypropylene"
Brooklyn 646 Beige/Green Rug By Think Rugs,TR10605,£59.00,Polypropylene
Chicago Cream Polyester Plain Rug by Origins,RG4704,£53.00,Polyester
Buddy Black Washable Plain Rug By Origins,RG8702,£54.96,Polypropylene
Extravagance Silver Shaggy Rug by Origins,RG10804,£29.00,Polyester
Galleria 079 0138 6888 Rust Beige Bordered Rug by Mastercraft,MC1666,£76.00,Polypropylene
Extravagance Ivory Shaggy Rug by Origins,RG10805,£29.00,Polyester
Moda Flatweave Trellis Grey Brown Rug by Oriental Weavers,OW10820,£17.00,Polypropylene
Plush Silver Luxury Shaggy Polyester Rug by Asiatic,AS06013,£128.86,Polyester
Morocco 2491 Beige/Cream Shaggy Rug By Think Rugs,TR8001,£109.00,Acrylic
Nourison Celestial CES08 Atlantic Rug ,NR0311,£35.00,Polypropylene
Fading World Salt & Pepper 8383 Luxury Designer Rug By De Poortere,DP1518,£209.00,"Cotton , Wool"
Nourison Vintage Kashan VKA02 Ivory Rug,NR1713,£38.00,Polypropylene
Zeal 43005 Berry Handtufted wool Rug by Harlequin,HQ0902,£479.00,Wool
Ascot Green Bordered Wool Rug by Asiatic,AS05907,£95.00,"Viscose , Wool"
Chicago Lavender Polyester Plain Rug by Origins,RG4735,£69.00,Polyester
Loran 56306 Yellow Hand Tufted Wool Rug by Ted Baker,TB0401,£416.00,"Viscose , Wool"
Arris 37307 Teal Geometric Hand Tufted Wool Rug by Wedgwood,WW0804,£418.00,"Viscose , Wool"
Fading World Medallion 9147 Cherry Rug by Louis De Poortere,DP1540,£149.00,Cotton
Serene Light Beige Plain Shaggy Rug by Oriental Weavers,OW16205,£27.00,Polypropylene
Nova NV11 Antique Navy Rug by Asiatic,AS13111,£68.36,Polypropylene
Rockpool Peacock Handtufted Wool Rug by William Yeoward,WY0301,£992.00,"Viscose , Wool"
Vapor CK972 Ivory Grey Rug by Calvin Klein,CK1507,£97.00,"Viscose , Polyester"
Luxe Faux Fur Ivory Plain Shaggy Rug by HMC,UR9303,£27.99,
Amitta Slate Hand Tufted Wool Rug by William Yeoward,WY1002,£992.00,"Viscose , Wool"
Orion OR11 Flag Grey Rug by Asiatic,AS16911,£50.00,"Polyester , Polypropylene"
Cozumel CZM03 Cream Outdoor Rug by Nourison ,NR5507,£49.00,Polypropylene
Bambino Jungle Mat by Oriental Weavers,OW8213,£27.00,Nylon
Hex Pink Hand Tufted Rug by Oriental Weavers,OW16604,£98.00,Wool
Carved Glamour Adobe Rose Shaggy Rug by Origins,RG8304,£69.00,Polyester
Morocco Ivory Charcoal Geometric Rug by Origins,RG12601,£70.00,Polypropylene
Ariana AR04 Vanilla Kilim Rug by Asiatic,AS17104,£56.00,Polypropylene
Boho 8280 Cream Grey Rug by Think Rugs,TR7824,£67.99,Polypropylene
Stitch 9682 Grey Black  Outdoor Rug by Think Rugs,TR6802,£63.99,Polypropylene
Chrome Latte Plain Rug by Katherine Carnaby,KC0114,£465.56,Viscose
Tartan Red Chequered Rug by Ultimate Rug,UR11503,£28.00,Polypropylene
Coast CS04 Taupe Rug by Katherine Carnaby,KC0304,£150.70,Viscose
Eaton Black Geometric Rug by Katherine Carnaby,KC0502,£455.19,Viscose
Chicago Forest Green Shaggy Polyester Rug by Origins,RG4753,£53.00,Polyester
3D Carved Diamond Blush Shaggy Rug by Ultimate Rug,UR11703,£35.00,Polyester
Odyssey Earth Gold Abstract Rug by Rug Style,UR12105,£16.50,Polypropylene
Rush CK953 Grey Beige Rug by Calvin Klein,CK1611,£55.00,"Polyester , Polypropylene"
Santa Fe Jade Outdoor Rug by William Yeoward,WY2002,£548.00,Recycled Material
Pinnacle Washable Ivory Plain Shaggy Rug by Rug Style,UR10706,£16.80,Polypropylene
Antibes AN03 White Grey Grid Outdoor Rug by Asiatic,AS18005,£42.20,Polypropylene
Monty MN02 Natural Tribal Outdoor Rug by Asiatic,AS18602,£42.20,Polypropylene
Habitat Aura 477304 Grey Outdoor Rug by Brink & Campman,BC3405,£198.00,Polypropylene
Giant Linear Stem 460703 Persimmon Outdoor Rug by Orla Kiely,OK1202,£228.00,Polypropylene
Monty MN07 Beige Diamond Outdoor Rug by Asiatic,AS18607,£42.20,Polypropylene
Salta SA05 White Outdoor Rug by Asiatic,AS18809,£44.60,Polypropylene
Chrome Copper Plain Rug by Katherine Carnaby,KC0104,£465.56,Viscose
Portland 670 V Geometric Rug by Oriental Weavers,OW107125,£37.00,Polypropylene
3D Geo Shaggy Red Rug by Origins,RG16304,£44.00,Polyester
Mad Men Dedalo 9204 Republic Green Flatweave Rug by Louis De Poortere,DP1848,£168.00,Polyester
Mad Men Stellar 9218 Lightning Turquoise Flatweave Rug By Louis De Poortere,DP1853,£168.00,Polyester
Luna LUN02 Blue Silver Wool Rug by Nourison,NR7005,"£1,998.00","Wool , Others"
Divine DIV11 Aqua Wool Rug by Nourison,NR2310,"£1,649.00","Viscose , Wool"
Nuance Module 9210 Yellow Meyer Flatweave Rug by Louis De Poortere,DP3906,£168.00,Polyester
Meditation Coral 9229 Shell Beige Flatweave Rug by Louis De Poortere,DP4005,£176.00,Polyester
Structures Baobab 9200 Black Water Flatweave Rug by Louis De Poortere,DP4104,£176.00,Polyester
Structures Baobab 9199 Za Copper Flatweave Rug by Louis De Poortere,DP4103,£176.00,Polyester
Mad Men Griff 8550 Liberty Gold Flatweave Rug by Louis De Poortere,DP1855,£168.00,"Cotton , Polyester"
Isla Charcoal Plain Shaggy Rug by Oriental Weavers,OW16101,£19.00,Polypropylene
Juno Aquamarine Abstract Rug by Asiatic,AS19802,£367.00,Viscose
Buddy Forest Green Washable Plain Rug by Origins,RG8765,£54.96,Polypropylene
Barnaby Sage Plain Shaggy Rug by Asiatic,AS19904,£387.00,Polyester
Villa Nova X Kyra Cane Glaze Celadon RG9184 Flatweave Rug,DP4206,£590.00,"Cotton , Polyester"
Berber Mono Cream Black Modern Rug by Origins,RG14802,£258.00,"Cotton , Wool"
Amay Natural/Beige Plain Rug by Origins,RG16702,£203.00,Natural Fibers
Aztec Outdoor Ghost/Dark Grey Rug by Origins,RG15805,£133.00,Polyester
Tropical Cut Pile Multi Outdoor Rug by Ultimate Rug,UR12503,£44.00,Polypropylene
Regency Kurt Navy Geometric Rug by Ultimate Rug,UR12610,£35.99,Polypropylene
Spirit Astra Navy Modern Rug by Ultimate Rug,UR9992,£27.00,Polypropylene
Galleria 063-0802-7626 Contemporary Rug by Mastercraft,MC16225,£78.00,Polypropylene
Spirit Structure Grey Black Geometric Rug by Ultimate Rug,UR99122,£27.00,Polypropylene
Spirit Glide Teal Geometric Rug by Ultimate Rug,UR99108,£27.00,Polypropylene
Ixora 442007 Emerald Palm Chartreuse Outdoor Rug by Harlequin,HQ2801,£228.00,Polypropylene
Galleria 063-0765-6250 Contemporary Rug by Mastercraft,MC16230,£132.00,Polypropylene
Modern Poly Blizzard Dark Grey Rug by Rug Style,UR4899,£26.00,Polypropylene
Royal Jewel JEW10 Beige Traditional Rug By Oriental Weavers,OW1302,£70.00,Wool
Gabbeh 217 X Oriental Rug By Oriental Weavers,OW5610,£84.00,Polypropylene
Royal Classic 635R Red And Orange Rug By Oriental Weavers,OW7809,£132.00,Wool
Sorento Seiano Blue/Gold Rug by Prestige,UR13904,£115.00,Polyester
Mumbai Pink Shaggy Rug by Ultimate Rug,UR10205,£49.00,Polyester
Rush CK953 Ivory Beige Rug by Calvin Klein,CK1613,£55.00,"Polyester , Polypropylene"
Royal Nomadic 5413 Ivory Black Shaggy Rug by Think Rugs,TR8935,£69.00,Polypropylene
Royal Jewel JEW08 Rose Traditional Rug By Oriental Weavers,OW1322,£70.00,Wool
Orbit Blocks Navy Rug by Ultimate Rug,UR13115,£42.00,Polyester
Halsey Natural Geometric Outdoor Rug by Asiatic,AS18501,£71.86,Recycled Material
Grayson Taupe Outdoor Rug by Asiatic,AS18401,£166.28,Recycled Material
Salta SA03 Geometric Outdoor Rug by Asiatic,AS18805,£44.60,Polypropylene
Elssa ELS14 Pacific Abstract Rug by Concept Looms,CL0206,£127.00,Polypropylene
Giant Linear Stem 460607 Seagrass Outdoor Rug by Orla Kiely,OK1203,£198.00,Polypropylene
Oslo OSL701 Lime Striped Rug by Concept Looms,CL0602,£147.00,"Cotton , Wool"
Rivi Kiwi 426908 Outdoor Rug by Scion,SC2501,£198.00,Polypropylene
Savannah Textured Grey Wool Rug by Oriental Weavers,OW7902,£113.00,Wool
Jazz JAZ06 Amber Geometric Outdoor Rug by Concept Looms,CL0705,£129.00,Recycled Material
Oslo OSL702 Pacific Striped Rug by Concept Looms,CL0612,£147.00,"Cotton , Wool"
San Rocco 089-0004/4002-99 Aqua Outdoor Rug by Mastercraft,MC6912,£37.99,"Polyester , Polypropylene"
Canyon 052-00297777 Beige Blue Contemporary Abstract Rug by Mastercraft,MC4654,£88.00,"Polyester , Polypropylene"
San Rocco 089-0001/2006-96 Gold Outdoor Rug by Mastercraft,MC6902,£37.99,"Polyester , Polypropylene"
Terrace Diamond Navy Outdoor Rug by Ultimate Rug,UR12401,£32.00,
Muse MU15 Blue Retro Abstract Rug by Asiatic,AS19025,£30.20,Polypropylene
Persian Outdoor Beige Traditional Rug by HMC,UR13801,£27.00,Polypropylene
Patio PAT19 Black Marble Outdoor Rug by Asiatic,AS08519-1,£35.16,Polypropylene
Kashqai 4370/300 Traditional Wool Rug by Mastercraft,MC1845,£158.00,Wool
Bazaar Jute 24875 Natural Rug by Think Rugs,TR12104,£158.99,Natural Fibers
Portland Blush Plain Shaggy Rug by Origins,RG15605,£39.00,Polyester
Noble House 1517 Multi Shaggy Rug by Think Rugs,TR4683,£144.99,"Acrylic , Polyester"
Vinci 1303B Geometric Rug by Oriental Weavers,OW17303,£64.00,Polypropylene
Olympia 2239 Grey Yellow Shaggy Rug by Think Rugs,TR11806,£47.99,Polypropylene
Decor Planet 141508 Grey Kids Rug by Brink & Campman,BC3704,£74.00,Wool
Monaco Tribal Charcoal Grey Outdoor Rug By Oriental Weavers,OW17405,£58.00,Polypropylene
Bullerswood 127301 Stone Mustard Floral Rug by Morris & CO.,MO1402,£568.00,Wool
Terra Nova Bark Outdoor Rug by Oriental Weavers,OW17203,£54.00,Polypropylene
Sarouk 561 C Traditional Rug by Oriental Weavers,OW17605,£88.99,Polyester
Gilbert 90 L Blue Grey Abstract Rug by Oriental Weavers,OW17709,£27.00,Polypropylene
Portland 1096 1 Modern Rug by Oriental Weavers,OW10757,£37.00,Polypropylene
Kendra 2603 H Blue Traditional Rug by Oriental Weavers,OW5933,£44.00,Polypropylene
Super Teddy Mustard Shaggy Rug by Think Rugs,TR12207,£55.99,Polyester
Lexus Red Wool Rug by Oriental Weavers,OW14507,£84.00,Wool
Boston Silver Plain Shaggy Rug by Ultimate Rug,UR1717,£39.00,Polyester
Valeria 5997 Y Multi Traditional Rug by Oriental Weavers,OW15905,£24.00,Polypropylene
Outdoor Oasis Charcoal Rug by Rug Style,UR9205,£60.00,Polypropylene
Patio PAT13 Pink Jewel Outdoor Rug by Asiatic,AS08514,£37.40,Polypropylene
Cabana 84006/7001 Modern Flatweave Rug by Mastercraft,MC6609,£175.99,"Wool , Others"
Dream DM06 Cream Sage Rug by Asiatic,AS03008,£113.24,Polypropylene
Valeria 1803 X Multi Traditional Rug by Oriental Weavers,OW15901,£24.00,Polypropylene
Bodega 040504 Stone Handtufted wool Rug by Harlequin,HQ1801,£479.00,Wool
Serene Pink Plain Shaggy Rug by Oriental Weavers,OW16206,£27.00,Polypropylene
Loran 56308 Navy Hand Tufted Wool Rug by Ted Baker,TB0402,£416.00,"Viscose , Wool"
Formation 40809 Mineral Handtufted wool Rug by Harlequin,HQ0103,£498.00,"Viscose , Wool"
Antiquarian Kilim 9112 Agdal Brown Flatweave Rug by Louis De Poortere,DP3503,£399.00,"Cotton , Wool"
Atlantic Streaks 9125 Nassau Red Flatweave Rug by Louis De Poortere,DP2112,£154.00,"Cotton , Polyester"
Sula 24307 Pacific Hand Tufted Wool Rug by Scion,SC0502,£395.00,Wool
Isla Gold Plain Shaggy Rug by Oriental Weavers,OW16105,£19.00,Polypropylene
Rhoscolyn Biscuit Hand Tufted Rug by William Yeoward,WY1101,£992.00,"Viscose , Wool"
Mariah Indigo Handtufted Wool Rug by William Yeoward,WY0401,£992.00,Wool
Rush CK950 Ivory Blue Rug by Calvin Klein,CK1601,£54.50,"Polyester , Polypropylene"
Orion OR05 Abstract Silver Rug by Asiatic,AS16905,£50.00,"Polyester , Polypropylene"
Amelie AM02 Meadow Floral Rug by Asiatic,AS16702,£57.00,Polypropylene
Cozumel CZM03 Grey Outdoor Rug by Nourison ,NR5509,£49.00,Polypropylene
Sketch SK01 Rhombus Grey Rug by Asiatic,AS17601,£42.20,Polypropylene
Luxe Faux Fur Charcoal Plain Shaggy Rug by HMC,UR9304,£27.99,
Hex Purple Hand Tufted Rug by Oriental Weavers,OW16605,£98.00,Wool
Grenada Ruby Persian Rug by Origins,RG12701,£49.00,Polypropylene
Tartan Grey Chequered Rug by Ultimate Rug,UR11505,£28.00,Polypropylene
Stitch 9682 Silver Black Outdoor Rug by Think Rugs,TR6803,£63.99,Polypropylene
Genuine Sheepskin Natural Rug by Origins,RG7807,£70.00,Leather
3D Carved Rose Red Shaggy Rug by Ultimate Rug,UR10301,£34.00,Polyester
Chrome Zinc Plain Rug by Katherine Carnaby,KC0105,£465.56,Viscose
Santa Monica 48644 Beige Cream Outdoor Rug by Think Rugs,TR6501,£57.99,Polypropylene
Eaton Gold Geometric Rug by Katherine Carnaby,KC0503,£455.19,Viscose
Chrome Charcoal Plain Rug by Katherine Carnaby,KC0115,£465.56,Viscose
Decor Shell Powder 141302 Orange Rug by Brink & Campman,BC3705,£74.00,Wool
Highland Check Light Grey Geometric Rug by Origins,RG13801,£119.00,Recycled Material
Amanpuri 145103 Russet Floral Rug by Sanderson,SD1602,£544.00,"Viscose , Wool"
Coast CS05 Camel Rug by Katherine Carnaby,KC0305,£150.70,Viscose
Bullerswood 127305 Charcoal Mustard Floral Rug by Morris & CO.,MO1404,£568.00,Wool
Sarouk 561 W Traditional Rug by Oriental Weavers,OW17607,£88.99,Polyester
Cut Stem 061405 Multi Wool Rug by Orla Kiely,OK1501,£358.00,Wool
Gilbert 90 X Multi Abstract Rug by Oriental Weavers,OW17711,£27.00,Polypropylene
Indra 145804 Slate Charcoal Floral Rug by Sanderson,SD1902,£544.00,Wool
Giant Sixties Stem 060703 Tomato Wool Rug by Orla Kiely,OK1801,£358.00,Wool
Portland 750 N Geometric Rug by Oriental Weavers,OW107127,£37.00,Polypropylene
Kaya Lila LY12 Traditional Rug by Asiatic,AS19212,£86.00,"Cotton , Others"
Portland 57 E Abstract Rug by Oriental Weavers,OW107107,£37.00,Polypropylene
Flores Azin FR01 Traditional Rug by Asiatic,AS19301,£96.00,Polypropylene
Habitat Aura 477306 Ochre Outdoor Rug by Brink & Campman,BC3406,£198.00,Polypropylene
Harrison Silver Modern Rug by Asiatic,AS19402,£209.00,Polyester
Kaya Vida KY04 Traditional Rug by Asiatic,AS19204,£86.00,"Cotton , Others"
Spirit Kite Navy Geometric Rug by Ultimate Rug,UR9973,£27.00,Polypropylene
Dazzle Ochre Plain Shaggy Rug by Ultimate Rug,UR13207,£62.50,Polyester
Nova 8879B Dark Blue Traditional Rug by Ultimate Rug,UR12909,£21.00,Heatset Polypropylene
Dazzle Grey Plain Shaggy  Rug by Ultimate Rug,UR13202,£62.50,Polyester
Rustic Textures RUS15 Grey Rust Rug by Nourison,NR1445,£94.00,"Polyester , Polypropylene"
Nova 9207A Cream Traditional Rug by Ultimate Rug ,UR12919,£21.00,Heatset Polypropylene
Spirit Star Natural Geometric Rug by Ultimate Rug,UR9964,£27.00,Polypropylene
Zola Tark Persian Rug by Asiatic,AS19501,£164.71,"Polyester , Polypropylene"
Aurora Ocean AU18 Rug by Asiatic,AS16124,£62.60,"Polyester , Polypropylene"
Prismatic PRS25 Multicolour Wool Rug by Nourison,NR3023,£649.00,"Viscose , Wool"
Zola Heris Persian Rug by Asiatic,AS19506,£164.71,"Polyester , Polypropylene"
Spectra Stilo Multicoloured Rug by Ultimate Rug,UR13415,£48.00,Heatset Polypropylene
Urban Quest Multi Funky Rug by Ultimate Rug,UR13304,£45.00,Heatset Polypropylene
Grand Expressions GNE02 Ivory Grey Rug by Kathy Ireland,KI0703,£78.00,"Polyester , Polypropylene"
Sherborne Red Traditional Rug by HMC,UR13611,£45.00,Polypropylene
Arabella Imperial Black White Distressed Abstract Rug by HMC,UR13503,£58.00,"Polyester , Polypropylene"
