Name,Product Id,Price,Material
Gallery Expression 9221 Orange Drip Flatweave Rug by Louis De Poortere,DP3304,£196.00,Cotton
Maine Ivory Shaggy Wool Rug by Rug Guru ,RG1201,£195.00,Wool
Noble House NH-5858 Beige/Brown Rug By Think Rugs,TR4602,£149.99,"Acrylic , Polyester"
Cashmere 5570 Red Traditional Rug by HMC,UR8719,£56.99,Polyester
Noble Art 6529 391 Red Beige Traditional Rug By Mastercraft,MC2304,£82.00,Polypropylene
Rush CK951 Grey Beige Rug by Calvin Klein,CK1607,£54.50,"Polyester , Polypropylene"
Michelle Collins MC04 Geometric Rug by Think Rugs,TR10101,£247.99,"Viscose , Wool"
Florenza 90 X Abstract Rug by Oriental Weavers ,OW6601,£63.00,Polypropylene
Japanese Floral Midnight 039708 Wool Rug by Florence Broadhurst,FB0102,£388.00,Wool
Spirit Triangle Red Modern Rug by Ultimate Rug,UR9921,£15.00,Polypropylene
Spirit Artiste Teal Modern Rug by Ultimate Rug,UR9990,£27.00,Polypropylene
Boston Duckegg Plain Shaggy Rug by Ultimate Rug,UR1702,£39.00,Polyester
Fading World Jade 8258 Designer Luxury Rug By De Poortere,DP1513,£149.00,"Cotton , Wool"
Dallas Charcoal Abstract Shaggy Rug By Origins,RG8501,£40.00,Polyester
Mad Men Cracks 8629 Abyss Blue Rug by Louis De Poortere,DP1837,£159.00,"Cotton , Polyester"
Nourison Passion PSN03 Fuchsia Rug ,NR1106,£68.00,Polypropylene
Whisper Tungsten Super soft Shaggy Rug by Asiatic,AS01610,£47.26,Polyester
Palais 18408 Hand Tufted Wool Rug by Bluebellgray,BB0401,£478.00,Wool
Viso 24003 Paprika Hand Tufted Wool Rug by Scion,SC0102,£348.00,Wool
York Duck Egg Simple and Stylish Wool Rug by Asiatic,AS02207,£42.20,Wool
Milano 046-0002/6191 Gold Abstract Rug by Mastercraft,MC6804,£67.99,"Polyester , Polypropylene"
Moda 47127/GC990 Pink Abstract Rug by Mastercraft,MC6706,£88.00,"Polyester , Polypropylene"
Moda 47124/GC995 Salmon Modern Rug by Mastercraft,MC6703,£88.00,"Polyester , Polypropylene"
Milano 046-0006/6161 Gold Modern Rug by Mastercraft,MC6803,£67.99,"Polyester , Polypropylene"
Milano 046-0006/6171 Taupe Abstract Rug by Mastercraft,MC6802,£67.99,"Polyester , Polypropylene"
Milano 046-0004/6141 Green Abstract Rug by Mastercraft,MC6808,£67.99,"Polyester , Polypropylene"
Milano 046-0004/6171 Taupe Modern Rug by Mastercraft,MC6807,£67.99,"Polyester , Polypropylene"
Milano 046-0002/6141 Green Abstract Rug by Mastercraft,MC6805,£67.99,"Polyester , Polypropylene"
Milano 046-0004/6161 Rust Modern Rug by Mastercraft,MC6809,£67.99,"Polyester , Polypropylene"
Tiago 46307/AF100 White Dotted Rug by Mastercraft,MC7001,£69.00,Polypropylene
Milano 046-0014/6191 Grey Modern Rug by Mastercraft,MC6811,£67.99,"Polyester , Polypropylene"
Milano 046-0014/6141 Grey Abstract Rug by Mastercraft,MC6810,£67.99,"Polyester , Polypropylene"
Milano 046-0014/6111 Grey Abstract Rug by Mastercraft,MC6812,£67.99,"Polyester , Polypropylene"
Tiago 46312/AF900 Black Abstract Rug by Mastercraft,MC7006,£69.00,Polypropylene
Tiago 46316/AF100 White Pictorial Rug by Mastercraft,MC7008,£69.00,Polypropylene
Tiago 46311/AF900 Black Abstract Rug by Mastercraft,MC7005,£69.00,Polypropylene
Tiago 46316/AF900 Black Modern Rug by Mastercraft,MC7010,£69.00,Polypropylene
Tiago 46323/AF100 Black Abstract Rug by Mastercraft,MC7012,£69.00,Polypropylene
Tiago 47001/AF102 Green Abstract Rug by Mastercraft,MC7015,£69.00,Polypropylene
Tiago 47001/AF101 Terracotta Abstract Rug by Mastercraft,MC7014,£69.00,Polypropylene
Tiago 47014/AF901 Black Geometric Rug by Mastercraft,MC7017,£167.00,Polypropylene
Tiago 47004/AF100 Beige Modern Rug by Mastercraft,MC7016,£167.00,Polypropylene
Nourison Ankara Global ANR17 Ivory Light Blue Rug by Nourison,NR1555,£39.50,"Polyester , Polypropylene"
Nourison Ankara Global ANR15 Ivory Navy Rug by Nourison,NR1549,£39.50,"Polyester , Polypropylene"
Canyon 052-00147777 Blue Contemporary Abstract Rug by Mastercraft,MC4649,£88.00,"Polyester , Polypropylene"
Nourison Ankara Global ANR16 Navy Multicolor Rug by Nourison,NR1552,£39.50,"Polyester , Polypropylene"
Canyon 052-00296454 Grey Contemporary Abstract Rug by Mastercraft,MC4653,£88.00,"Polyester , Polypropylene"
Canyon 052-00423535 Traditional Floral Rug by Mastercraft,MC4655,£176.99,"Polyester , Polypropylene"
Canyon 052 - 0023 6484 Grey Contemporary Abstract Rug by Mastercraft,MC4651,£88.00,"Polyester , Polypropylene"
Canyon 052-00623676 Grey Contemporary Abstract Rug by Mastercraft,MC4658,£177.00,"Polyester , Polypropylene"
Canyon 052-00643676 Grey Beige Contemporary Abstract Rug by Mastercraft,MC4659,£88.00,"Polyester , Polypropylene"
Galleria 063-07645280 Multi Contemporary Geometric Rug by Mastercraft,MC16219,£76.00,Polypropylene
Galleria 063-07723747 Natural Contemporary Abstract Rug by Mastercraft,MC16222,£132.00,Polypropylene
Carnegie Black Red Dotted Rug by Unique Rugs,FT1234,£82.80,Polypropylene
Galleria 063-07726270 Natural Contemporary Abstract Rug by Mastercraft,MC16223,£132.00,Polypropylene
Brooklyn Natural Striped Rug by Unique Rugs,FT1233,£82.80,Polypropylene
Canyon 052-00653525 Silver Contemporary Abstract Rug by Mastercraft,MC4660,£88.00,"Polyester , Polypropylene"
Empire Grey Abstract Rug by Unique Rugs,FT1235,£82.80,Polypropylene
Moma Beige Geometric Rug by Unique Rugs,FT1239,£82.80,Polypropylene
Lexington Beige Abstract Rug by Unique Rugs,FT1237,£82.80,Polypropylene
Soho Ivory Abstract Rug by Unique Rugs,FT1241,£82.80,Polypropylene
Moma Grey Black Geometric Rug by Unique Rugs,FT1240,£82.80,Polypropylene
Moma Multi Geometric Rug by Unique Rugs,FT1238,£82.80,Polypropylene
Hudson Grey Black Abstract Rug by Unique Rugs,FT1236,£82.80,Polypropylene
Tribeca Multi Striped Rug by Unique Rugs,FT1242,£82.80,Polypropylene
Village Multi Geometric Rug by Unique Rugs,FT1243,£82.80,Polypropylene
Metropolitan Multi Funky Rug by Unique Rugs,FT1244,£82.80,Polypropylene
Cyrus CY10 Beni Kilim Rug by Asiatic,AS17010,£50.60,Polyester
Palermo Deep Sea Striped Wool Rug by ITC Natural Luxury Flooring,IT3302,"£1,057.00","Viscose , Wool"
Palermo Castle Grey Striped Wool Rug by ITC Natural Luxury Flooring,IT3301,"£1,057.00","Viscose , Wool"
Palermo Golden Glory Striped Wool Rug by ITC Natural Luxury Flooring,IT3303,"£1,057.00","Viscose , Wool"
Sunshine Blue Wool Rug by ITC Natural Luxury Flooring,IT3401,£815.00,"Viscose , Wool"
Sunshine Gold Wool Rug by ITC Natural Luxury Flooring,IT3402,£815.00,"Viscose , Wool"
Palermo Royal Red Striped Wool Rug by ITC Natural Luxury Flooring,IT3304,"£1,057.00","Viscose , Wool"
Galleria 063-07637656 White Multi Contemporary Abstract Rug by Mastercraft,MC16216,£132.00,Polypropylene
Sunshine Red Wool Rug by ITC Natural Luxury Flooring,IT3404,£815.00,"Viscose , Wool"
Sunshine Grey Wool Rug by ITC Natural Luxury Flooring,IT3403,£815.00,"Viscose , Wool"
Nourison Maxell MAE14 Ivory Red Rug ,NR0835,£107.00,Polyester
Metro Multi Wool Rug by Ultimate Rug,UR11203,£57.00,Wool
Nourison Maxell MAE15 Multicolored Rug ,NR0837,£107.00,Polyester
3D Triangles Pink Wool Rug by Origins,RG11102,£129.00,Wool
3D Triangles Grey Wool Rug by Origins,RG11101,£129.00,Wool
Nourison Navajo NAV06 White Rug ,NR0907,£38.00,"Polyester , Polypropylene"
Gatsby Coral Rug by Asiatic,AS14602,£256.04,Viscose
Nourison Rustic Textures RUS05 Beige/Grey Rug ,NR1411,£94.00,"Polyester , Polypropylene"
Gatsby Red Rug by Asiatic,AS14607,£256.04,Viscose
Reef RF11 Floral Green Multi Wool Rug by Asiatic,AS14102,£126.50,Wool
Gatsby Green Rug by Asiatic,AS14606,£256.04,Viscose
Reef RF13 Big Geo Blue Wool Rug by Asiatic,AS14103,£126.50,Wool
Shimmer Blush Polyester Shaggy Rug by Origins,RG4812,£58.00,Polyester
Morocco Charcoal Ivory Geometric Rug by Origins,RG12602,£79.00,Polypropylene
Agadir Natural Striped Rug by Unique Rugs,FT1251,£94.80,Polypropylene
Marrakech Ivory Traditional Rug by Unique Rugs,FT1254,£94.80,Polypropylene
Delave Grey Persian Rug by Unique Rugs,FT1245,£82.80,Polypropylene
Genuine Sheepskin Forest Green Rug by Origins,RG7815,£70.00,Leather
Casablanca Ivory Geometric Rug by Unique Rugs,FT1253,£94.80,Polypropylene
Agadir Ochre Striped Rug by Unique Rugs,FT1252,£94.80,Polypropylene
Rabat Blue Striped Rug by Unique Rugs,FT1255,£94.80,Polypropylene
Tangeri Natural Striped Rug by Unique Rugs,FT1256,£94.80,Polypropylene
Reef RF04 Flag Blue Wool Rug by Asiatic,AS14110,£81.50,Wool
Reef RF08 Flag Grey Wool Rug by Asiatic,AS14112,£81.50,Wool
Topaz G4705 Red Traditional Rug by Think Rugs,TR6201,£38.99,Others
Tate Silver Wool Rug by Asiatic,AS15301,£243.80,"Viscose , Wool"
Camden Pink Wool Rug by Asiatic,AS07007-1,£309.13,"Viscose , Wool"
Camden Blue Wool Rug by Asiatic,AS07008,£325.40,"Viscose , Wool"
Camden Gold Wool Rug by Asiatic,AS07005-1,£309.13,"Viscose , Wool"
Albany Ogee Charcoal Wool Rug by Asiatic,AS14203,£66.20,Wool
Reef RF07 Pixel Grey Multi Wool Rug by Asiatic,AS14118,£126.50,Wool
Nourison Organic Modern OM001 Glacier Rug,NR2001,£197.00,Polyester
Nourison Organic Modern OM005 Aqua Navy Rug,NR2015,£97.00,Polyester
Nourison Organic Modern OM001 Ocean Rug,NR2005,£97.00,Polyester
Form Ochre Wool Rug by Asiatic,AS15402,£321.32,Wool
Merino Whisp Spring Wool Rug by Prestige,UR10006,£123.00,Wool
Merino Parker Stripe Orange Wool Rug by Prestige,UR10007,£69.00,Wool
Form Blue Wool Rug by Asiatic,AS15404,£321.32,Wool
Merino Parker Stripe Blue Wool Rug by Prestige,UR10008,£69.00,Wool
Merino Modern Leaf Red Wool Rug by Prestige,UR10012,£123.00,Wool
Merino 3D Cubes Blue Wool Rug by Prestige,UR10011,£69.00,Wool
Modern Poly Curve Black Rug by Rug Style,UR4826,£19.00,Polypropylene
Merino Memphis Linear Grey Wool Rug by Prestige,UR10010,£69.00,Wool
Modern Poly Curve Brown Rug by Rug Style,UR4827,£19.00,Polypropylene
Nourison SHA10 Silk Shadows Sterling Wool Rug,NR3213,£818.00,"Wool , Silk"
Form Pink Wool Rug by Asiatic,AS15406,£321.32,Wool
Nourison SHA02 Silk Shadows Silver Wool Rug,NR3205,£995.00,"Wool , Silk"
Ombre Green Wool Rug by Asiatic,AS15504,£239.24,Wool
Chicago Taupe Shaggy Polyester Rug by Origins,RG4749,£53.00,Polyester
Form Green Wool Rug by Asiatic,AS15405,£321.32,Wool
Prism Mint Wool Rug by Asiatic,AS15004,£160.16,"Viscose , Acrylic , Cotton , Polyester , Wool"
Prism Pink Wool Rug by Asiatic,AS15005,£160.16,"Viscose , Acrylic , Cotton , Polyester , Wool"
Lulu Green Shaggy Rug by Asiatic,AS13911,£73.40,Polyester
Kingsley Blue Rug by Asiatic,AS15201,£264.20,Viscose
Kingsley Pink Rug by Asiatic,AS15206,£264.20,Viscose
Kingsley Silver Rug by Asiatic,AS15203,£264.20,Viscose
Indigo Black Plain Shaggy Rug by HMC,UR7402,£41.00,Polyester
Mayfair Black Plain Shaggy Rug by HMC,UR7702,£59.00,Polyester
Mayfair White Plain Shaggy Rug by HMC,UR7711,£59.00,Polyester
Nourison SHA10 Silk Shadows Wine Wool Rug,NR3215,£818.00,"Wool , Silk"
Nourison SHA14 Silk Shadows Graphite Wool Rug,NR3217,£818.00,"Wool , Silk"
Nourison SHA16 Silk Shadows Silver Grey Wool Rug,NR3223,£818.00,"Wool , Silk"
Oakland Pistachio Plain Wool Rug by HMC,UR7805,£110.00,Wool
Nourison STA02 Starlight Midnight Wool Rug,NR3301,£319.00,"Luxcelle , Wool"
Nourison TWI01 Twilight Silver Wool Rug,NR3401,£838.00,"Viscose , Wool"
Nourison SHA14 Silk Shadows Ivory Silver Wool Rug,NR3219,£818.00,"Wool , Silk"
Nourison STA02 Starlight Noon Sky Wool Rug,NR3303,£319.00,"Luxcelle , Wool"
Nourison STA02 Starlight Sea Mist Wool Rug,NR3305,£319.00,"Luxcelle , Wool"
Nourison TWI05 Twilight Slate Wool Rug,NR3409,£838.00,"Viscose , Wool"
Nourison TWI03 Twilight Ivory Grey Wool Rug,NR3405,£838.00,"Viscose , Wool"
Nourison TWI06 Twilight Bone Wool Rug,NR3411,£838.00,"Viscose , Wool"
Nourison STA02 Starlight Pewter Wool Rug,NR3307,£319.00,"Luxcelle , Wool"
Nourison TWI07 Twilight Sea Mist Wool Rug,NR3413,£838.00,"Viscose , Wool"
Oakland Red Plain Wool Rug by HMC,UR7806,£110.00,Wool
Nourison TWI08 Twilight Cream Wool Rug,NR3415,£838.00,"Viscose , Wool"
Nourison STA02 Starlight Opal Wool Rug,NR3309,£319.00,"Luxcelle , Wool"
Nourison STA02 Starlight Morning Wool Rug,NR3313,£319.00,"Luxcelle , Wool"
Nourison TWI02 Twilight Ivory Wool Rug,NR3403,£838.00,"Viscose , Wool"
Nourison TWI09 Twilight Ivory Wool Rug,NR3417,£838.00,"Viscose , Wool"
Nourison STA02 Starlight Oyster Wool Rug,NR3311,£319.00,"Luxcelle , Wool"
Nourison TWI10 Twilight Ivory Wool Rug,NR3421,£838.00,"Viscose , Wool"
Nourison TWI11 Twilight Flint Wool Rug,NR3423,£838.00,"Viscose , Wool"
Nourison TWI10 Twilight Hazel Wool Rug,NR3419,£838.00,"Viscose , Wool"
Nourison TWI11 Twilight Seafoam Wool Rug,NR3425,£838.00,"Viscose , Wool"
Nourison TWI12 Twilight Ivory Grey Wool Rug,NR3427,£838.00,"Viscose , Wool"
Nourison TWI13 Twilight Onyx Wool Rug,NR3429,£838.00,"Viscose , Wool"
Nourison TWI14 Twilight Smoke Wool Rug,NR3431,£838.00,"Viscose , Wool"
Tropics 6093 Cream/Multi Rug By Think Rugs,TR11107-1,£132.29,"Polyester , Polypropylene"
Matrix MT04 Beige/Grey Rug by Think Rugs,TR9132-1,£41.39,Polypropylene
Matrix MT04 Black/Grey Rug by Think Rugs,TR9135-1,£175.48,Polypropylene
Portofino M289 Brown/Beige Rug by Think Rugs ,TR10901-1,£71.09,Polypropylene
Pembroke G2075 Grey/Blue Rug by Think Rugs,TR10804,£37.99,Polypropylene
Matrix MT04 Beige/Terra Rug by Think Rugs,TR9133-1,£21.59,Polypropylene
Lima 3413 Sand Rug by ITC Natural Luxury Flooring,IT2102,£324.00,"Natural Fibers , Polypropylene"
Marbles Taupe Luxury Wool Rug by Origins,RG10104,£109.00,Wool
Marrakesh Dark Blue Traditional Rug By Think Rugs,TR8719-1,£23.39,Polypropylene
Marbles Grey Luxury Wool Rug by Origins,RG10101,£109.00,Wool
Lima 3412 Light Beige Rug by ITC Natural Luxury Flooring,IT2101,£324.00,"Natural Fibers , Polypropylene"
Lima 3415 Dark Beige Rug by ITC Natural Luxury Flooring,IT2103,£324.00,"Natural Fibers , Polypropylene"
Lima 3416 Grey Rug by ITC Natural Luxury Flooring,IT2104,£324.00,"Natural Fibers , Polypropylene"
Lima 3423 Silver Rug by ITC Natural Luxury Flooring,IT2105,£324.00,"Natural Fibers , Polypropylene"
Lima 3427 Black Rug by ITC Natural Luxury Flooring,IT2106,£324.00,"Natural Fibers , Polypropylene"
Retro Dash Grey  Traditional Rug by ITC Natural Luxury Flooring,IT2302,£350.00,Cotton
Retro Ash Grey Traditional Rug by ITC Natural Luxury Flooring,IT2303,£350.00,Cotton
Retro Sand Traditional Rug by ITC Natural Luxury Flooring,IT2304,£530.00,Cotton
Retro Charcoal Traditional Rug by ITC Natural Luxury Flooring,IT2301,£350.00,Cotton
Retro Azur Blue 1 Traditional Rug by ITC Natural Luxury Flooring,IT2305,£350.00,Cotton
Union Oyster Textured Wool Rug by Rug Guru,RG1605,£185.00,Wool
Retro Azur Blue 2 Traditional Rug by ITC Natural Luxury Flooring,IT2306,£350.00,Cotton
Atlantic Streaks 8717 Parsons Powder Rug by Louis De Poortere,DP2110,£168.00,"Cotton , Polyester , Others"
Orient Oyster Stripe Wool Rug by Rug Guru,RG1505-1,£113.40,Viscose
Antique Heriz 8705 Seray Orange Rug by Louis De Poortere,DP2303,£399.00,Cotton
Antiquarian Bakhtiari Khedive Multi 8713 Rug by Louis De Poortere,DP2403,£399.00,Cotton
Fusion Ivory Wool Rug by Rug Guru,RG1301,£175.00,Wool
Maine Midnight Shaggy Wool Rug by Rug Guru ,RG1205,£195.00,Wool
Elements EL-65 Grey Wool Rug By Think Rugs,TR1318,£229.99,Wool
Boston Heather Plain Shaggy Rug by Ultimate Rug,UR1703,£39.00,Polyester
Kashqai 4306 400 Green Traditional Wool Rug By Mastercraft,MC1806,£158.00,Wool
Monaco Ochre Wool Rug by Origins,RG9603-1,£162.00,Wool
Floral Art Gem Beige Wool Rug By Ultimate Rug,UR2819,£82.00,Wool
Floral Art Sovereign Grey Wool Rug By Ultimate Rug,UR2804,£47.00,Wool
Unique Kids Truck Style Wool Rug by Prestige,UR3102,£74.99,Wool
Nourison TWI15 Twilight Grey Wool Rug,NR3433,£838.00,"Viscose , Wool"
Nourison TWI15 Twilight Ivory Grey Wool Rug,NR3435,£838.00,"Viscose , Wool"
Retro Flower Choc Designer Wool Rug By Ultimate Rug,UR2708,£47.00,Wool
Nourison TWI18 Twilight Storm Wool Rug,NR3439,£838.00,"Viscose , Wool"
Nourison TWI19 Twilight Multicolor Wool Rug,NR3441,£838.00,"Viscose , Wool"
Nourison TWI17 Twilight Moon Wool Rug,NR3437,£838.00,"Viscose , Wool"
Nourison TWI21 Twilight Grey Red Wool Rug,NR3445,£838.00,"Viscose , Wool"
Japanese Fans Gold 039305 Wool Rug by Florence Broadhurst,FB0103,£388.00,Wool
Nourison TWI20 Twilight Grey Blue Wool Rug,NR3443,£838.00,"Viscose , Wool"
Nourison TWI22 Twilight Blue Grey Wool Rug,NR3447,£838.00,"Viscose , Wool"
Waterwave Stripe Citron 039906 Wool Rug by Florence Broadhurst,FB0107,£388.00,Wool
Nourison TWI24 Twilight Blue Ivory Wool Rug,NR3451,£838.00,"Viscose , Wool"
Waterwave Stripe Pearl 039908 Wool Rug by Florence Broadhurst,FB0108,£388.00,Wool
Tortoiseshell Stripe Jade 039808 Wool Rug by Florence Broadhurst,FB0106,£388.00,Wool
Turnabouts Claret 039200 Wool Rug by Florence Broadhurst,FB0109,£388.00,Wool
Floral 300 Poppy 039600 Wool Rug by Florence Broadhurst,FB0112,£388.00,Wool
Slub Charcoal 039405 Wool Rug by Florence Broadhurst,FB0114,£388.00,Wool
Modern Poly Moda Green Rug by Rug Style,UR4833,£26.00,Polypropylene
Modern Poly Moda Plum Rug by Rug Style,UR4832,£19.00,Polypropylene
Slub Mist 039401 Wool Rug by Florence Broadhurst,FB0113,£388.00,Wool
Cotswold Natural COTW03 Charcoal Rug by Concept Looms,CL0503,£128.00,"Cotton , Wool"
Modern Poly Stripe Red Rug by Rug Style,UR4854,£19.00,Polypropylene
Modern Poly Waves Red Rug by Rug Style,UR4859,£19.00,Polypropylene
Spirit Blocks Purple Modern Rug by Ultimate Rug,UR9905,£27.00,Polypropylene
Kiddy Play Polka Heart Pastel Pink Rug By Flair Rugs,FR1105,£25.00,Polyester
Modern Poly Newton Black Rug by Rug Style,UR4839,£19.00,Polypropylene
Spirit Blocks Grey Ochre Modern Rug by Ultimate Rug,UR9911,£27.00,Polypropylene
Tula Blue Soft Plain Polyester Rug by Asiatic,AS07704-1,£130.15,Polyester
Spirit Leaf Beige Modern Rug by Ultimate Rug,UR9923,£27.00,Polypropylene
Spirit Leaf Grey Teal Modern Rug by Ultimate Rug,UR9924,£15.00,Polypropylene
Spirit Leaf Grey Ochre Modern Rug by Ultimate Rug,UR9926,£15.00,Polypropylene
Traditional Poly Sandringham Black Rug by Rug Style,UR5171,£36.00,Polypropylene
Traditional Poly Coronation Green Rug by Rug Style,UR5189,£36.00,Polypropylene
Whisper Duckegg Plain Rug by Rug Style,UR9105,£48.00,Polypropylene
Abacus Charcoal Plain Rug By Asiatic,AS08701-1,£301.15,Natural Fibers
Flossy Ivory Plain Shaggy Rug by Ultimate Rug,UR10603,£37.00,Polyester
Logan LG10 Ogee Ivory Grey Rug By Asiatic,AS11210-1,£83.60,Polypropylene
Whisper Silver Plain Rug by Rug Style,UR9102,£48.00,Polypropylene
Flossy Mink Plain Shaggy Rug by Ultimate Rug,UR10604,£37.00,Polyester
Acapulco ACA 681 Taupe Abstract Rug,OB0104,£52.92,Polypropylene
Willow Boughs 428607 Leafy Arbor Outdoor Rug by Morris & CO.,MO1004,£264.00,Polypropylene
Acapulco ACA 680 Silver Abstract Rug,OB0101,£52.92,Polypropylene
Esmae Putty Shaggy Rug by Asiatic,AS03206-1,£92.15,Polypropylene
Acapulco ACA 683 Taupe Abstract Rug,OB0108,£52.92,Polypropylene
Enzo Light Grey Textured Plain Rug By Asiatic,AS09704-1,£595.65,"Viscose , Cotton , Wool"
Copacabana COP 362 Anthracite Bordered Rug,OB1003,£48.60,Polypropylene
Matrix Cuzzo MAX70 Cuzzo Blue Wool Rug by Asiatic,AS04909,£98.00,Wool
Matrix Cuzzo MAX69 Cuzzo Mustard Wool Rug by Asiatic,AS04911,£114.80,Wool
Curacao CUR 490 Plain Petrol Rug,OB1205,£74.52,Polyester
Copacabana COP 361 Taupe Abstract Rug,OB1002,£48.60,Polypropylene
Curacao CUR 490 Plain Ivory Rug,OB1203,£74.52,Polyester
Dakota DAK 130 Burlywood Wool Rug,OB1301,£268.92,Wool
Copacabana COP 362 Taupe Bordered Rug,OB1004,£48.60,Polypropylene
Dolce Green Luxury Handmade Rug by Asiatic,AS00109,£240.92,Cotton
Curacao CUR 490 Plain Silver Rug,OB1207,£74.52,Polyester
Dakota DAK 130 Gainsboro Wool Rug,OB1303,£268.92,Wool
Curacao CUR 490 Plain Powder Pink Rug,OB1206,£74.52,Polyester
Dakota DAK 130 Charlton Wool Rug,OB1302,£268.92,Wool
Funky FKY 300 Anthracite Plain Rug,OB1701,£46.80,Polypropylene
Dakota DAK 130 Savannah Wool Rug,OB1304,£268.92,Wool
Funky FKY 300 Aqua Plain Rug,OB1702,£34.80,Polypropylene
Onix ON16 Tribal Mix Teal Rug by Asiatic,AS11314-1,£111.87,Cotton
Pimlico Fine Stripe Spice Rug By Asiatic,AS11409-1,£80.56,Wool
Dash DA02 Dark Multi Wool Rug by Asiatic,AS16402-1,£107.58,Wool
Dash DA04 Bright Multi Wool Rug by Asiatic,AS16404-1,£108.53,Wool
Skandi Look Boho Grey Outdoor Rug by Unique Rugs,FT0206,£142.80,Polypropylene
Onix ON14 Tribal Mix Green Rug by Asiatic,AS11315-1,£104.36,Cotton
Easy Care Boheme Natural Denim Rug by Unique Rugs,FT0928,£82.80,"Cotton , Polyester"
Riley RL01 Blue Rug by Asiatic,AS00404-1,£210.33,Polyester
Matrix Wire MAX38 Green Wool Rug by Asiatic,AS04107-1,£154.09,Wool
Riley RL02 Red Rug by Asiatic,AS00402-1,£209.37,Polyester
Cozy Green Modern Rug by Asiatic,AS00504-1,£204.54,Polyester
Auckland Honey Sheepskin Rug by Asiatic,AS00701-1,£36.29,"Acrylic , Polyester"
Whisper Yellow Shaggy Rug by Asiatic,AS01620-1,£69.08,Polyester
Auckland Pink Sheepskin Rug by Asiatic,AS00702-1,£36.29,"Acrylic , Polyester"
Elona Grey Cowhide Rug by Asiatic,AS00801-1,£271.32,Leather
Elona Silver Cowhide Rug by Asiatic,AS00802-1,£271.32,Leather
Elona Aqua Cowhide Rug by Asiatic,AS00803-1,£271.32,Leather
Elona Gold Cowhide Rug by Asiatic,AS00804-1,£271.32,Leather
Xylo Red Cross Stitch Rug by Asiatic,AS01002-1,£386.65,Leather
Xylo Laser Mosaic Rug by Asiatic,AS01003-1,£386.65,Leather
Shade SH05 Leaf Grey Wool Rug by Asiatic,AS01705-1,£250.75,"Polyester , Wool"
Colt CL10 Stripe Mustard Rug by Asiatic,AS02810,£68.36,Polypropylene
Colt CL12 Diamond Grey Rug by Asiatic,AS02812-1,£65.89,Polypropylene
Colt CL11 Stripe Pink Rug by Asiatic,AS02811-1,£65.89,Polypropylene
Shade SH03 Strata Grey Wool Rug by Asiatic,AS01706-1,£89.15,"Polyester , Wool"
Colt CL15 Fan Pink Rug by Asiatic,AS02815-1,£65.89,Polypropylene
Colt CL09 Chevron Pink Rug by Asiatic,AS02809-1,£65.89,Polypropylene
Colt CL16 Pyramid Rust Rug by Asiatic,AS02816-1,£65.89,Polypropylene
Colt CL18 Pyramid Mustard Rug by Asiatic,AS02818-1,£64.94,Polypropylene
Dream DM07 Cream Beige Rug by Asiatic,AS03004-1,£107.58,Polypropylene
Dream DM08 Brown Cream Rug by Asiatic,AS03005-1,£205.08,Polypropylene
Willow Silver Faux Fur Rug by Asiatic,AS13601-1,£24.89,Polyester
Willow Taupe Faux Fur Rug by Asiatic,AS13605-1,£24.89,Polyester
Willow Navy Tipped Faux Fur Rug by Asiatic,AS13603-1,£24.89,Polyester
Viscount V55 Traditional Rug by Asiatic,AS08206-1,£79.16,Polypropylene
Willow Pink Faux Fur Rug by Asiatic,AS13602-1,£24.89,Polyester
Chobi CB01 Traditional Wool Rug by Asiatic,AS08001-1,£282.11,Wool
Viscount V56 Traditional Rug by Asiatic,AS08207-1,£99.68,Polypropylene
Chobi CB02 Traditional Wool Rug by Asiatic,AS08002-1,£282.11,Wool
Willow Charcoal Tipped Faux Fur Rug by Asiatic,AS13606-1,£24.89,Polyester
Chobi CB05 Traditional Wool Rug by Asiatic,AS08005-1,£282.11,Wool
Chobi CB03 Traditional Wool Rug by Asiatic,AS08003-1,£282.11,Wool
Chobi CB06 Traditional Wool Rug by Asiatic,AS08006-1,£282.11,Wool
Chobi CB09 Traditional Wool Rug by Asiatic,AS08009-1,£300.35,Wool
Chobi CB07 Traditional Wool Rug by Asiatic,AS08007-1,£282.11,Wool
Da Vinci 057 0125 4646 Blue Grey Traditional Rug by Mastercraft,MC3520-1,£482.60,Polypropylene
Amira AM005 Abstract Rug By Asiatic,AS08805-1,£228.68,Wool
Amira AM001 Geometric Rug By Asiatic,AS08801-1,£228.68,Wool
Amira AM003 Geometric Rug By Asiatic,AS08803-1,£228.68,Wool
Chobi CB08 Traditional Wool Rug by Asiatic,AS08008-1,£300.35,Wool
Amira AM004 Abstract Rug By Asiatic,AS08804-1,£228.68,Wool
Kashqai 4327 400 Blue Traditional Wool Rug By Mastercraft,MC1822-1,£321.09,Wool
Amira AM006 Geometric Rug By Asiatic,AS08806-1,£228.68,Wool
Amira AM007 Abstract Rug By Asiatic,AS08807-1,£228.68,Wool
Arlo AR01 Black Geometric Rug By Asiatic,AS08901-1,£76.95,Polyester
Arlo AR02 Denim Geometric Rug By Asiatic,AS08902-1,£76.95,Polyester
Arlo AR05 Chevron Blue Geometric Rug By Asiatic,AS08905-1,£97.92,Polyester
Arlo AR03 Black Geometric Rug By Asiatic,AS08903-1,£72.00,Polyester
Arlo AR06 Chevron Lemon / Grey Geometric Rug By Asiatic,AS08906-1,£103.36,Polyester
Arlo AR04 Ivory Geometic Rug By Asiatic,AS08904-1,£76.95,Polyester
Arlo AR08 Chevron Red Geometric Rug By Asiatic,AS08908-1,£72.00,Polyester
Echo EC01 Leopard Rug By Asiatic,AS09601-1,£242.25,Polypropylene
Blade Border Silver Charcoal Rug By Asiatic,AS09004,£215.24,Viscose
Blox Coral Geometric Rug By Asiatic,AS09102-1,£134.71,Wool
Echo EC07 Water Floral Taupe Rug By Asiatic,AS09607-1,£83.60,Polypropylene
Fresco Red Rug By Asiatic,AS10105-1,£269.19,"Cotton , Wool"
Echo EC05 Broken Stripe Pearl Rug By Asiatic,AS09605-1,£83.60,Polypropylene
Fresco Blue Rug By Asiatic,AS10102-1,£149.23,"Cotton , Wool"
Fresco Grey Rug By Asiatic,AS10103-1,£149.23,"Cotton , Wool"
Fresco Nude Rug By Asiatic,AS10104-1,£149.23,"Cotton , Wool"
Hackney Kelim Diamond Taupe Rug By Asiatic,AS10303-1,£264.99,"Cotton , Wool"
Hackney Kelim Geo Heather Rug By Asiatic,AS10306-1,£156.01,"Cotton , Wool"
Pinnacle Washable Grey Plain Shaggy Rug by Rug Style,UR10707,£16.80,Polypropylene
Orbit Geometric Silver Rug by Ultimate Rug,UR13109,£42.00,Polyester
Aspen 1682 Ivory Grey Shaggy Rug by Think Rugs,TR7505,£57.99,Polypropylene
Boardwalk Grey Multi Outdoor Rug by Asiatic,AS18201,£92.84,Recycled Material
Halsey Mustard Geometric Outdoor Rug by Asiatic,AS18503,£71.86,Recycled Material
Pollo POLL106 Silver Grey Abstract Rug by Concept Looms ,CL1011,£79.00,"Polyester , Polypropylene"
Blaze BLZ07 Silver Grey Abstract Rug by Concept Looms,CL1213,£68.00,"Polyester , Polypropylene"
Bianco 185TA Grey Gold Abstract Rug by HMC,UR12301,£64.99,"Polyester , Polypropylene"
Varanda VA02 Beige Diamond Outdoor Rug by Asiatic,AS18902,£42.20,Polypropylene
Bazaro BAZ10 Natural Blue Striped Rug by Concept Looms,CL0110,£48.00,Polypropylene
